{
  "modelVersion":"1.0","configRevision":"site-a-1","producerId":"PLC-A","session":"commissioning-001","sequence":12,"kind":"snapshot","generatedAt":1790000001000,
  "samples": {
    "bess.power":{"value":-1250000,"quality":"good","observedAt":1790000000000,"sequence":12},
    "bess.soc":{"value":67.4,"quality":"good","observedAt":1790000000000,"sequence":12},
    "bess.state":{"value":"running","quality":"good","observedAt":1790000000000,"sequence":12},
    "bess.energy":{"value":"9007199254740993","quality":"good","observedAt":1790000000000,"sequence":6},
    "dso.allowance":{"value":60,"quality":"good","observedAt":1790000000000,"sequence":12}
  }
}
